[{"claim_id":"allocation-holdout-recall-at-8","evaluation_run_digest":"94d0037bc4c58ec15204c545e668c24b77ccc8214151445bb1b56678f937bef4","metric":"allocation_holdout_recall_at_8","schema_version":"1.0","supporting_artifact":"metrics.json","text":"On this frozen synthetic Allocation Holdout, EdgeQueue recovered 0.80 Recall at 8. This small synthetic-corpus result does not establish production performance or Calibration Promotion.","value":0.8}]
